{
  "id": "tiefling-sorcerer",
  "skill": "dnd-build",
  "level": "complex",
  "caster": true,
  "lang": "en",
  "seed": 20260711,
  "prompt": "Create a Dungeons & Dragons 2024 (5.5e) level-1 character, fixed by this brief: tieffelin ensorceleur, charlatan background, ability scores {\"for\":8,\"dex\":14,\"con\":13,\"int\":10,\"sag\":12,\"cha\":15}, starting-equipment option A. Choose the remaining options (skills, spells, style, languages) legally and report the final sheet.",
  "reference": {
    "methode": "standard",
    "_id": "tiefling-sorcerer",
    "nom": "Ember",
    "classe": "ensorceleur",
    "espece": "tieffelin",
    "historique": "charlatan",
    "abilityScores": {
      "for": 8,
      "dex": 14,
      "con": 13,
      "int": 10,
      "sag": 12,
      "cha": 15
    },
    "lignage": "tieffelin-abyssal",
    "ensorceleur-competences": [
      "arcanes",
      "intimidation"
    ],
    "ensorceleur-cantrips": [
      "aspersion-acide",
      "contact-glacial",
      "coup-au-but",
      "coup-de-tonnerre"
    ],
    "ensorceleur-prepares": [
      "agrandissement-rapetissement",
      "amelioration-de-caracteristique"
    ],
    "ensorceleur-equipement": "A",
    "tieffelin-abyssal-caracteristique-incantation": "int",
    "charlatan-caracteristiques": "dex",
    "doue-maitrises": [
      "acrobaties",
      "arcanes",
      "athletisme"
    ],
    "origine-langues-choix": [
      "draconique",
      "elfique"
    ]
  }
}
