{
  "id": "elf-druid",
  "skill": "dnd-build",
  "level": "intermediate",
  "caster": true,
  "lang": "en",
  "seed": 20260711,
  "prompt": "Create a Dungeons & Dragons 2024 (5.5e) level-1 character, fixed by this brief: elfe (elfe-sylvestre) druide, guide background, ability scores {\"for\":10,\"dex\":14,\"con\":13,\"int\":12,\"sag\":15,\"cha\":8}, starting-equipment option A. Choose the remaining options (skills, spells, style, languages) legally and report the final sheet.",
  "reference": {
    "method": "standard",
    "_id": "elf-druid",
    "name": "Sylwen",
    "class": "druid",
    "species": "elf",
    "lineage": "elfe-sylvestre",
    "background": "guide",
    "abilityScores": {
      "str": 10,
      "dex": 14,
      "con": 13,
      "int": 12,
      "wis": 15,
      "cha": 8
    },
    "druid-competences": [
      "arcana",
      "animal-handling"
    ],
    "druid-ordre-primitif": "gardien",
    "druid-cantrips": [
      "guidance",
      "poison-spray"
    ],
    "druid-prepares": [
      "enlarge-reduce",
      "aid",
      "befuddlement",
      "enhance-ability"
    ],
    "druid-equipement": "A",
    "elf-sens-aiguises": "intuition",
    "elf-sylvestre-caracteristique-incantation": "int",
    "guide-caracteristiques": "dex",
    "initie-a-la-magie-liste": "druid",
    "initie-a-la-magie-carac": "int",
    "origine-langues-choix": [
      "draconique",
      "elfique"
    ],
    "initie-a-la-magie-cantrips": [
      "thunderclap",
      "shillelagh"
    ],
    "initie-a-la-magie-sort-1": "animal-friendship"
  }
}
