{
  "id": "goliath-barbarian",
  "skill": "dnd-build",
  "level": "simple",
  "caster": false,
  "lang": "en",
  "seed": 20260711,
  "prompt": "Create a Dungeons & Dragons 2024 (5.5e) level-1 character, fixed by this brief: goliath barbare, soldat background, ability scores {\"for\":15,\"dex\":14,\"con\":14,\"int\":8,\"sag\":10,\"cha\":12}, starting-equipment option A. Choose the remaining options (skills, spells, style, languages) legally and report the final sheet.",
  "reference": {
    "method": "standard",
    "_id": "goliath-barbarian",
    "name": "Karn",
    "class": "barbarian",
    "species": "goliath",
    "background": "soldier",
    "abilityScores": {
      "str": 15,
      "dex": 14,
      "con": 14,
      "int": 8,
      "wis": 10,
      "cha": 12
    },
    "barbarian-competences": [
      "animal-handling",
      "nature"
    ],
    "barbarian-equipement": "A",
    "goliath-ascendance-gigante": "brulure-ignee",
    "soldier-caracteristiques": "str",
    "soldier-boite-de-jeux": "boite-de-jeux",
    "origine-langues-choix": [
      "draconique",
      "elfique"
    ]
  }
}
