{
  "id": "dwarf-fighter",
  "skill": "dnd-build",
  "level": "simple",
  "caster": false,
  "lang": "en",
  "seed": 20260711,
  "prompt": "Create a Dungeons & Dragons 2024 (5.5e) level-1 character, fixed by this brief: nain guerrier, soldat background, ability scores {\"for\":15,\"dex\":13,\"con\":14,\"int\":8,\"sag\":12,\"cha\":10}, starting-equipment option A. Choose the remaining options (skills, spells, style, languages) legally and report the final sheet.",
  "reference": {
    "method": "standard",
    "_id": "dwarf-fighter",
    "name": "Thera",
    "class": "fighter",
    "species": "dwarf",
    "background": "soldier",
    "abilityScores": {
      "str": 15,
      "dex": 13,
      "con": 14,
      "int": 8,
      "wis": 12,
      "cha": 10
    },
    "fighter-competences": [
      "acrobatics",
      "animal-handling"
    ],
    "fighter-style-de-combat": "archerie",
    "fighter-equipement": "A",
    "soldier-caracteristiques": "str",
    "soldier-boite-de-jeux": "boite-de-jeux",
    "origine-langues-choix": [
      "draconique",
      "elfique"
    ]
  }
}
