{
  "id": "human-ranger",
  "skill": "dnd-build",
  "level": "intermediate",
  "caster": true,
  "lang": "en",
  "seed": 20260711,
  "prompt": "Create a Dungeons & Dragons 2024 (5.5e) level-1 character, fixed by this brief: humain rodeur, guide background, ability scores {\"for\":12,\"dex\":15,\"con\":13,\"int\":8,\"sag\":14,\"cha\":10}, starting-equipment option A. Choose the remaining options (skills, spells, style, languages) legally and report the final sheet.",
  "reference": {
    "method": "standard",
    "_id": "human-ranger",
    "name": "Wren",
    "class": "ranger",
    "species": "human",
    "background": "guide",
    "abilityScores": {
      "str": 12,
      "dex": 15,
      "con": 13,
      "int": 8,
      "wis": 14,
      "cha": 10
    },
    "ranger-competences": [
      "athletics",
      "animal-handling",
      "insight"
    ],
    "ranger-prepares": [
      "aid",
      "alarm"
    ],
    "ranger-equipement": "A",
    "human-competent": "acrobaties",
    "human-polyvalent": "bagarreur-de-tavernes",
    "guide-caracteristiques": "dex",
    "initie-a-la-magie-liste": "druid",
    "initie-a-la-magie-carac": "int",
    "origine-langues-choix": [
      "draconique",
      "elfique"
    ],
    "initie-a-la-magie-cantrips": [
      "guidance",
      "poison-spray"
    ],
    "initie-a-la-magie-sort-1": "animal-friendship"
  }
}
