{
  "id": "halfling-rogue-saves",
  "skill": "dnd-check",
  "level": "intermediate",
  "lang": "en",
  "base": {
    "methode": "standard",
    "_id": "halfling-rogue",
    "nom": "Pip",
    "classe": "roublard",
    "espece": "halfelin",
    "historique": "criminel",
    "abilityScores": {
      "for": 8,
      "dex": 15,
      "con": 13,
      "int": 12,
      "sag": 10,
      "cha": 14
    },
    "roublard-competences": [
      "acrobaties",
      "athletisme",
      "intimidation",
      "intuition"
    ],
    "roublard-langue": "draconique",
    "roublard-equipement": "A",
    "criminel-caracteristiques": "dex",
    "origine-langues-choix": [
      "draconique",
      "elfique"
    ],
    "roublard-expertise": [
      "acrobaties",
      "athletisme"
    ]
  },
  "prompt": "Audit this D&D 2024 level-1 character sheet and report every rules error with a correction. If it is correct, report no findings.\n\nSHEET:\n{\n  \"class\": \"roublard\",\n  \"species\": \"halfelin\",\n  \"lineage\": null,\n  \"background\": \"criminel\",\n  \"abilityScores\": {\n    \"for\": 8,\n    \"dex\": 15,\n    \"con\": 13,\n    \"int\": 12,\n    \"sag\": 10,\n    \"cha\": 14\n  },\n  \"proficiencyBonus\": 2,\n  \"armorClass\": 13,\n  \"hitPoints\": 9,\n  \"passivePerception\": 10,\n  \"savingThrowProficiencies\": [\n    \"dex\",\n    \"cha\"\n  ],\n  \"skillProficiencies\": [\n    \"acrobaties\",\n    \"athletisme\",\n    \"discretion\",\n    \"escamotage\",\n    \"intimidation\",\n    \"intuition\"\n  ],\n  \"cantrips\": [],\n  \"preparedSpells\": [],\n  \"fightingStyle\": null\n}",
  "mutations": [
    {
      "field": "saving-throws",
      "from": [
        "dex",
        "int"
      ],
      "to": [
        "dex",
        "cha"
      ],
      "category": "wrong-edition",
      "severity": "critical",
      "expected": "dex,int"
    }
  ]
}
