{
  "id": "human-fighter-saves",
  "skill": "dnd-check",
  "level": "intermediate",
  "lang": "en",
  "base": {
    "methode": "standard",
    "_id": "human-fighter",
    "nom": "Bram",
    "classe": "guerrier",
    "espece": "humain",
    "historique": "garde",
    "abilityScores": {
      "for": 15,
      "dex": 14,
      "con": 13,
      "int": 10,
      "sag": 12,
      "cha": 8
    },
    "guerrier-competences": [
      "acrobaties",
      "dressage"
    ],
    "guerrier-style-de-combat": "archerie",
    "guerrier-equipement": "A",
    "humain-competent": "acrobaties",
    "humain-polyvalent": "bagarreur-de-tavernes",
    "garde-caracteristiques": "for",
    "garde-boite-de-jeux": "boite-de-jeux",
    "origine-langues-choix": [
      "draconique",
      "elfique"
    ]
  },
  "prompt": "Audit this D&D 2024 level-1 character sheet and report every rules error with a correction. If it is correct, report no findings.\n\nSHEET:\n{\n  \"class\": \"guerrier\",\n  \"species\": \"humain\",\n  \"lineage\": null,\n  \"background\": \"garde\",\n  \"abilityScores\": {\n    \"for\": 15,\n    \"dex\": 14,\n    \"con\": 13,\n    \"int\": 10,\n    \"sag\": 12,\n    \"cha\": 8\n  },\n  \"proficiencyBonus\": 2,\n  \"armorClass\": 16,\n  \"hitPoints\": 11,\n  \"passivePerception\": 13,\n  \"savingThrowProficiencies\": [\n    \"dex\",\n    \"cha\"\n  ],\n  \"skillProficiencies\": [\n    \"acrobaties\",\n    \"athletisme\",\n    \"dressage\",\n    \"perception\"\n  ],\n  \"cantrips\": [],\n  \"preparedSpells\": [],\n  \"fightingStyle\": \"archerie\"\n}",
  "mutations": [
    {
      "field": "saving-throws",
      "from": [
        "for",
        "con"
      ],
      "to": [
        "dex",
        "cha"
      ],
      "category": "wrong-edition",
      "severity": "critical",
      "expected": "for,con"
    }
  ]
}
