{
  "id": "elf-bard",
  "skill": "dnd-build",
  "level": "complex",
  "caster": true,
  "lang": "en",
  "seed": 20260711,
  "prompt": "Create a Dungeons & Dragons 2024 (5.5e) level-1 character, fixed by this brief: elfe (haut-elfe) barde, artiste background, ability scores {\"for\":8,\"dex\":14,\"con\":12,\"int\":10,\"sag\":13,\"cha\":15}, starting-equipment option A. Choose the remaining options (skills, spells, style, languages) legally and report the final sheet.",
  "reference": {
    "method": "standard",
    "_id": "elf-bard",
    "name": "Lyric",
    "class": "bard",
    "species": "elf",
    "lineage": "haut-elfe",
    "background": "entertainer",
    "abilityScores": {
      "str": 8,
      "dex": 14,
      "con": 12,
      "int": 10,
      "wis": 13,
      "cha": 15
    },
    "bard-competences": [
      "arcana",
      "athletics",
      "stealth"
    ],
    "bard-instruments": [
      "instrument-de-musique"
    ],
    "bard-cantrips": [
      "true-strike",
      "thunderclap"
    ],
    "bard-prepares": [
      "enlarge-reduce",
      "aid",
      "befuddlement",
      "enhance-ability"
    ],
    "bard-equipement": "A",
    "elf-sens-aiguises": "intuition",
    "haut-elfe-caracteristique-incantation": "int",
    "entertainer-caracteristiques": "str",
    "entertainer-instrument": "instrument-de-musique",
    "musicien-instruments": [
      "instrument-de-musique"
    ],
    "origine-langues-choix": [
      "draconique",
      "elfique"
    ]
  }
}
