{
  "id": "dwarf-fighter-hp",
  "skill": "dnd-check",
  "level": "simple",
  "lang": "en",
  "base": {
    "methode": "standard",
    "_id": "dwarf-fighter",
    "nom": "Thera",
    "classe": "guerrier",
    "espece": "nain",
    "historique": "soldat",
    "abilityScores": {
      "for": 15,
      "dex": 13,
      "con": 14,
      "int": 8,
      "sag": 12,
      "cha": 10
    },
    "guerrier-competences": [
      "acrobaties",
      "dressage"
    ],
    "guerrier-style-de-combat": "archerie",
    "guerrier-equipement": "A",
    "soldat-caracteristiques": "for",
    "soldat-boite-de-jeux": "boite-de-jeux",
    "origine-langues-choix": [
      "draconique",
      "elfique"
    ]
  },
  "prompt": "Audit this D&D 2024 level-1 character sheet and report every rules error with a correction. If it is correct, report no findings.\n\nSHEET:\n{\n  \"class\": \"guerrier\",\n  \"species\": \"nain\",\n  \"lineage\": null,\n  \"background\": \"soldat\",\n  \"abilityScores\": {\n    \"for\": 15,\n    \"dex\": 13,\n    \"con\": 14,\n    \"int\": 8,\n    \"sag\": 12,\n    \"cha\": 10\n  },\n  \"proficiencyBonus\": 2,\n  \"armorClass\": 16,\n  \"hitPoints\": 16,\n  \"passivePerception\": 11,\n  \"savingThrowProficiencies\": [\n    \"for\",\n    \"con\"\n  ],\n  \"skillProficiencies\": [\n    \"acrobaties\",\n    \"athletisme\",\n    \"dressage\",\n    \"intimidation\"\n  ],\n  \"cantrips\": [],\n  \"preparedSpells\": [],\n  \"fightingStyle\": \"archerie\"\n}",
  "mutations": [
    {
      "field": "hit-points",
      "from": 13,
      "to": 16,
      "category": "arithmetic-error",
      "severity": "significant",
      "expected": 13
    }
  ]
}
