{
  "id": "elf-druid-hp",
  "skill": "dnd-check",
  "level": "simple",
  "lang": "en",
  "base": {
    "methode": "standard",
    "_id": "elf-druid",
    "nom": "Sylwen",
    "classe": "druide",
    "espece": "elfe",
    "lignage": "elfe-sylvestre",
    "historique": "guide",
    "abilityScores": {
      "for": 10,
      "dex": 14,
      "con": 13,
      "int": 12,
      "sag": 15,
      "cha": 8
    },
    "druide-competences": [
      "arcanes",
      "dressage"
    ],
    "druide-ordre-primitif": "gardien",
    "druide-cantrips": [
      "assistance",
      "bouffee-de-poison"
    ],
    "druide-prepares": [
      "agrandissement-rapetissement",
      "aide",
      "alienation",
      "amelioration-de-caracteristique"
    ],
    "druide-equipement": "A",
    "elfe-sens-aiguises": "intuition",
    "elfe-sylvestre-caracteristique-incantation": "int",
    "guide-caracteristiques": "dex",
    "initie-a-la-magie-liste": "druide",
    "initie-a-la-magie-carac": "int",
    "origine-langues-choix": [
      "draconique",
      "elfique"
    ],
    "initie-a-la-magie-cantrips": [
      "coup-de-tonnerre",
      "crosse-des-druides"
    ],
    "initie-a-la-magie-sort-1": "amitie-avec-les-animaux"
  },
  "prompt": "Audit this D&D 2024 level-1 character sheet and report every rules error with a correction. If it is correct, report no findings.\n\nSHEET:\n{\n  \"class\": \"druide\",\n  \"species\": \"elfe\",\n  \"lineage\": \"elfe-sylvestre\",\n  \"background\": \"guide\",\n  \"abilityScores\": {\n    \"for\": 10,\n    \"dex\": 14,\n    \"con\": 13,\n    \"int\": 12,\n    \"sag\": 15,\n    \"cha\": 8\n  },\n  \"proficiencyBonus\": 2,\n  \"armorClass\": 13,\n  \"hitPoints\": 12,\n  \"passivePerception\": 12,\n  \"savingThrowProficiencies\": [\n    \"int\",\n    \"sag\"\n  ],\n  \"skillProficiencies\": [\n    \"arcanes\",\n    \"discretion\",\n    \"dressage\",\n    \"intuition\",\n    \"survie\"\n  ],\n  \"cantrips\": [\n    \"assistance\",\n    \"bouffee-de-poison\",\n    \"coup-de-tonnerre\",\n    \"crosse-des-druides\",\n    \"druidisme\"\n  ],\n  \"preparedSpells\": [\n    \"agrandissement-rapetissement\",\n    \"aide\",\n    \"alienation\",\n    \"amelioration-de-caracteristique\",\n    \"amitie-avec-les-animaux\",\n    \"communication-avec-les-animaux\"\n  ],\n  \"fightingStyle\": null\n}",
  "mutations": [
    {
      "field": "hit-points",
      "from": 9,
      "to": 12,
      "category": "arithmetic-error",
      "severity": "significant",
      "expected": 9
    }
  ]
}
