{
  "id": "wizard-cantrips",
  "skill": "dnd-lookup",
  "level": "simple",
  "lang": "en",
  "prompt": "List every Wizard cantrip in the 2024 catalogue.",
  "oracle": {
    "mode": "list",
    "expected": [
      "acid-splash",
      "poison-spray",
      "chill-touch",
      "true-strike",
      "thunderclap",
      "elementalism",
      "friends",
      "toll-the-dead",
      "minor-illusion",
      "light",
      "dancing-lights",
      "mage-hand",
      "message",
      "mind-sliver",
      "shocking-grasp",
      "prestidigitation",
      "ray-of-frost",
      "mending",
      "fire-bolt",
      "blade-ward"
    ]
  }
}
