{
  "id": "gnome-warlock",
  "skill": "dnd-build",
  "level": "complex",
  "caster": true,
  "lang": "en",
  "seed": 20260711,
  "prompt": "Create a Dungeons & Dragons 2024 (5.5e) level-1 character, fixed by this brief: gnome (gnome-des-forets) occultiste, ermite background, ability scores {\"for\":8,\"dex\":14,\"con\":13,\"int\":12,\"sag\":10,\"cha\":15}, starting-equipment option A. Choose the remaining options (skills, spells, style, languages) legally and report the final sheet.",
  "reference": {
    "method": "standard",
    "_id": "gnome-warlock",
    "name": "Fizz",
    "class": "warlock",
    "species": "gnome",
    "lineage": "gnome-des-forets",
    "background": "hermit",
    "abilityScores": {
      "str": 8,
      "dex": 14,
      "con": 13,
      "int": 12,
      "wis": 10,
      "cha": 15
    },
    "warlock-competences": [
      "arcana",
      "history"
    ],
    "warlock-cantrips": [
      "poison-spray",
      "chill-touch"
    ],
    "warlock-prepares": [
      "befuddlement",
      "armor-of-agathys"
    ],
    "warlock-manifestation": "armure-d-ombres",
    "warlock-equipement": "A",
    "gnome-des-forets-caracteristique-incantation": "int",
    "hermit-caracteristiques": "con",
    "origine-langues-choix": [
      "draconique",
      "elfique"
    ]
  }
}
